{"contract_version":"v1","run_id":"run_v1_01J8Q3Z4R5T6V7W8X9Y0ABCDEF","definition_id":"definition_v1_01J8Q3Z4R5T6V7W8X9Y0ABCDEF","workflow_id":"workflow_v1_01J8Q3Z4R5T6V7W8X9Y0ABCDEF","workflow_version":3,"definition_revision":5,"definition_hash":"sha256:aaaaaaaaaaaaaaaaaaaaaaaaaaaaaaaaaaaaaaaaaaaaaaaaaaaaaaaaaaaaaaaa","request_id":"request_v1_01J8Q3Z4R5T6V7W8X9Y0ABCDEF","task_ref":"task_v1_01J8Q3Z4R5T6V7W8X9Y0ABCDEF","project_ref":"project_v1_01J8Q3Z4R5T6V7W8X9Y0ABCDEF","trace_id":"trace_v1_01J8Q3Z4R5T6V7W8X9Y0ABCDEF","mode":"manual","input_artifact_refs":["artifact_v1_01J8Q3Z4R5T6V7W8X9Y0ABCDEF"],"input_evidence_refs":["evidence_v1_01J8Q3Z4R5T6V7W8X9Y0ABCDEF"],"timeout_seconds":600,"max_steps":50,"max_retries":2,"budget":{"max_cost_minor":750,"currency":"EUR","quote_ref":"quote_v1_01J8Q3Z4R5T6V7W8X9Y0ABCDEF","approval_ref":"approval_v1_01J8Q3Z4R5T6V7W8X9Y0ABCDEF"},"idempotency_key":"n8n-request-01J8Q3Z4R5T6V7W8X9Y0ABCDEF"}
